{"meta":{"generatedBy":"scripts/market_build.py","patch":"DE Update 185872 (2026-09-23)","datCommit":"0c38027504532826c9922e4db77e2c1d33554291","datSha256":"4aa2f0a719e88e5f1502517eddb27c669aeb40c2fe9d8c4f3eec7751c01e7baa","feeResource":78,"engineVerifiedInPinnedBuild":false},"baseFee":0.3,"guilds":{"tech":15,"fee":0.15,"civs":["Armenians","Bengalis","Berbers","Bohemians","Britons","Bulgarians","Burgundians","Burmese","Byzantines","Celts","Cumans","Dravidians","Ethiopians","Georgians","Goths","Huns","Incas","Italians","Japanese","Jurchens","Khitans","Koreans","Lithuanians","Malians","Mayans","Muisca","Persians","Portuguese","Romans","Saxons","Shu","Sicilians","Spanish","Tatars","Teutons","Turks","Varangians","Vietnamese","Wu"]},"civFees":{"Saracens":{"tech":355,"fee":0.05}},"uniqueFees":{"Hindustanis":{"tech":506,"name":"大干道","fee":0.1}},"engine":{"lot":100,"step":2,"minBase":20,"maxBase":9999,"initial":{"Food":115,"Wood":100,"Stone":130},"rounding":"nearest-per-lot","status":"按每笔整数报价估算；未在 DE 185872 引擎逐笔实测。游戏内部可能保留小数余额，累计黄金和预算不足临界点可能不同。","sources":[{"url":"https://www.ageofempires.com/news/age-of-empires-ii-definitive-edition-update-preview-125283/","scope":"官方：食物起始基价 115；标准首笔买价 150、卖价 81；木材和石料起价未变。"},{"url":"https://www.ageofempires.com/news/age-of-empires-ii-definitive-edition-update-66692/","scope":"官方：非萨拉森文明研究行会后的最低买价从 25 重设为 23；萨拉森最低买价从 25 重设为 21。与最低基价 20 乘相应费率一致，不附加 25 下限。"},{"url":"https://ageofempires.fandom.com/wiki/Market_(Age_of_Empires_II)","scope":"百科现有 Exchange 段：100 单位成交、步进 2、20–9999 基价。其行会最低价 25 已与官方更正冲突，不采纳该旧值；不能视为同版引擎实测。"},{"url":"https://www.reddit.com/r/aoe2/comments/wqvj3x/market_changes_you_may_have_missed/","scope":"2022 玩家记录步进从 3 恢复为 2，仅作历史交叉参考，不作为固定版本的数值证据。"}]}}
